{
  "schema_version": 1,
  "id": "00000000-0000-0000-0000-000000000011",
  "north_angle_deg": 90,
  "levels": [
    {
      "index": 0,
      "elevation_mm": 0,
      "floor_to_floor_mm": 3000,
      "outline": {
        "rings": [
          {
            "points": [
              [0, 0],
              [12000, 0],
              [12000, 6000],
              [6000, 6000],
              [6000, 10000],
              [0, 10000]
            ]
          }
        ]
      }
    }
  ]
}
