{
  "schema_version": 1,
  "id": "00000000-0000-0000-0000-000000000012",
  "north_angle_deg": 0,
  "levels": [
    {
      "index": 0,
      "elevation_mm": 0,
      "floor_to_floor_mm": 3000,
      "outline": {
        "rings": [
          {
            "points": [
              [0, 0],
              [9000, 0],
              [9000, 9000],
              [0, 9000]
            ]
          }
        ]
      },
      "cores": [
        {
          "rings": [
            {
              "points": [
                [3500, 3500],
                [5500, 3500],
                [5500, 5500],
                [3500, 5500]
              ]
            }
          ]
        }
      ]
    },
    {
      "index": 1,
      "elevation_mm": 3000,
      "floor_to_floor_mm": 3000,
      "outline": {
        "rings": [
          {
            "points": [
              [0, 0],
              [9000, 0],
              [9000, 9000],
              [0, 9000]
            ]
          },
          {
            "points": [
              [3500, 3500],
              [3500, 5500],
              [5500, 5500],
              [5500, 3500]
            ]
          }
        ]
      }
    }
  ]
}
